{
  "schema_version": "1.0.0",
  "report_id": "AEG-EVAL-FAIRNESS-ROBUSTNESS-001",
  "source_assurance_report": {
    "relative_path": "data/validation_reports/assurance/step9_policy_assurance_report.json",
    "sha256": "26e31e5b867dae491f8bc06c06fca70e852dafdd4fa8621305e11a31690954d5",
    "case_count": 120,
    "pair_count": 60
  },
  "evaluator": {
    "policy_id": "AEGIS-FAIRNESS-ROBUSTNESS-GATES",
    "policy_version": "1.0.0",
    "evaluator_version": "0.1.0",
    "policy_sha256": "e422c806da3d4db041f981eb6c13986b1a7fcb64cea186168188b08d62954d2b"
  },
  "decision_policy": {
    "policy_id": "AEGIS-FEDERAL-BASE-POLICY",
    "version": "1.0.0",
    "sha256": "fd5f39cec54f4bb57491d60bff9326f9b854209d3ab907cdab8768029a35447f"
  },
  "summary": {
    "case_count": 120,
    "pair_count": 60,
    "stage_gate_passed": true,
    "production_readiness": false,
    "failed_quality_gate_count": 0
  },
  "exact_match_metrics": {
    "case_count": 120,
    "exact_case_count": 120,
    "case_exact_match_rate": 1.0,
    "action_exact_match_rate": 1.0,
    "priority_exact_match_rate": 1.0,
    "deadline_exact_match_rate": 1.0,
    "review_exact_match_rate": 1.0,
    "containment_exact_match_rate": 1.0,
    "closure_exact_match_rate": 1.0,
    "invariant_pass_rate": 1.0
  },
  "safety_metrics": {
    "safety_relevant_case_count": 98,
    "under_triage_count": 0,
    "over_triage_count": 0,
    "safety_under_triage_count": 0,
    "safety_recall": 1.0,
    "under_triage_cases": [],
    "over_triage_cases": []
  },
  "abstention_metrics": {
    "expected_hold_count": 54,
    "actual_hold_count": 54,
    "true_hold_count": 54,
    "false_hold_count": 0,
    "missed_hold_count": 0,
    "hold_precision": 1.0,
    "hold_recall": 1.0,
    "hold_f1": 1.0
  },
  "counterfactual_metrics": {
    "pair_count": 60,
    "passed_pair_count": 60,
    "counterfactual_consistency_rate": 1.0,
    "sector_disparity_count": 0,
    "action_pair_gap_count": 0,
    "priority_pair_gap_count": 0,
    "review_pair_gap_count": 0,
    "containment_pair_gap_count": 0,
    "closure_pair_gap_count": 0,
    "deadline_pair_mean_gap_hours": 0.0,
    "deadline_pair_max_gap_hours": 0.0
  },
  "monotonicity_metrics": {
    "comparison_count": 110,
    "passed_comparison_count": 110,
    "violation_count": 0,
    "monotonicity_rate": 1.0,
    "violations": []
  },
  "subgroup_metrics": {
    "by_sector": {
      "defence_logistics": {
        "case_count": 60,
        "passed_case_count": 60,
        "exact_match_rate": 1.0,
        "under_triage_count": 0,
        "under_triage_rate": 0.0,
        "mean_deadline_hours": 166.2,
        "action_distribution": {
          "ACT": 12,
          "ATTEND": 10,
          "HOLD": 27,
          "TRACK": 11
        },
        "priority_distribution": {
          "CRITICAL": 10,
          "EMERGENCY": 4,
          "HIGH": 25,
          "INFORMATIONAL": 11,
          "MEDIUM": 10
        }
      },
      "healthcare": {
        "case_count": 60,
        "passed_case_count": 60,
        "exact_match_rate": 1.0,
        "under_triage_count": 0,
        "under_triage_rate": 0.0,
        "mean_deadline_hours": 166.2,
        "action_distribution": {
          "ACT": 12,
          "ATTEND": 10,
          "HOLD": 27,
          "TRACK": 11
        },
        "priority_distribution": {
          "CRITICAL": 10,
          "EMERGENCY": 4,
          "HIGH": 25,
          "INFORMATIONAL": 11,
          "MEDIUM": 10
        }
      }
    },
    "by_affectedness": {
      "affected": {
        "case_count": 24,
        "passed_case_count": 24,
        "exact_match_rate": 1.0,
        "under_triage_count": 0,
        "under_triage_rate": 0.0,
        "mean_deadline_hours": 47.0,
        "action_distribution": {
          "ACT": 12,
          "ATTEND": 10,
          "HOLD": 2
        },
        "priority_distribution": {
          "CRITICAL": 8,
          "EMERGENCY": 4,
          "HIGH": 12
        }
      },
      "fixed": {
        "case_count": 24,
        "passed_case_count": 24,
        "exact_match_rate": 1.0,
        "under_triage_count": 0,
        "under_triage_rate": 0.0,
        "mean_deadline_hours": 660.3333333333334,
        "action_distribution": {
          "HOLD": 2,
          "TRACK": 22
        },
        "priority_distribution": {
          "HIGH": 2,
          "INFORMATIONAL": 22
        }
      },
      "probably_affected": {
        "case_count": 24,
        "passed_case_count": 24,
        "exact_match_rate": 1.0,
        "under_triage_count": 0,
        "under_triage_rate": 0.0,
        "mean_deadline_hours": 39.0,
        "action_distribution": {
          "ACT": 12,
          "ATTEND": 10,
          "HOLD": 2
        },
        "priority_distribution": {
          "CRITICAL": 8,
          "EMERGENCY": 4,
          "HIGH": 12
        }
      },
      "probably_not_affected": {
        "case_count": 24,
        "passed_case_count": 24,
        "exact_match_rate": 1.0,
        "under_triage_count": 0,
        "under_triage_rate": 0.0,
        "mean_deadline_hours": 62.333333333333336,
        "action_distribution": {
          "HOLD": 24
        },
        "priority_distribution": {
          "CRITICAL": 2,
          "HIGH": 2,
          "MEDIUM": 20
        }
      },
      "unknown": {
        "case_count": 24,
        "passed_case_count": 24,
        "exact_match_rate": 1.0,
        "under_triage_count": 0,
        "under_triage_rate": 0.0,
        "mean_deadline_hours": 22.333333333333332,
        "action_distribution": {
          "HOLD": 24
        },
        "priority_distribution": {
          "CRITICAL": 2,
          "HIGH": 22
        }
      }
    },
    "by_operational_profile": {
      "active_exploitation": {
        "case_count": 10,
        "passed_case_count": 10,
        "exact_match_rate": 1.0,
        "under_triage_count": 0,
        "under_triage_rate": 0.0,
        "mean_deadline_hours": 164.8,
        "action_distribution": {
          "ACT": 4,
          "HOLD": 4,
          "TRACK": 2
        },
        "priority_distribution": {
          "EMERGENCY": 4,
          "HIGH": 2,
          "INFORMATIONAL": 2,
          "MEDIUM": 2
        }
      },
      "baseline": {
        "case_count": 10,
        "passed_case_count": 10,
        "exact_match_rate": 1.0,
        "under_triage_count": 0,
        "under_triage_rate": 0.0,
        "mean_deadline_hours": 211.2,
        "action_distribution": {
          "ATTEND": 4,
          "HOLD": 4,
          "TRACK": 2
        },
        "priority_distribution": {
          "HIGH": 6,
          "INFORMATIONAL": 2,
          "MEDIUM": 2
        }
      },
      "catastrophic_impact": {
        "case_count": 10,
        "passed_case_count": 10,
        "exact_match_rate": 1.0,
        "under_triage_count": 0,
        "under_triage_rate": 0.0,
        "mean_deadline_hours": 164.8,
        "action_distribution": {
          "ACT": 4,
          "HOLD": 4,
          "TRACK": 2
        },
        "priority_distribution": {
          "EMERGENCY": 4,
          "HIGH": 2,
          "INFORMATIONAL": 2,
          "MEDIUM": 2
        }
      },
      "critical_cvss": {
        "case_count": 10,
        "passed_case_count": 10,
        "exact_match_rate": 1.0,
        "under_triage_count": 0,
        "under_triage_rate": 0.0,
        "mean_deadline_hours": 192.0,
        "action_distribution": {
          "ATTEND": 4,
          "HOLD": 4,
          "TRACK": 2
        },
        "priority_distribution": {
          "HIGH": 6,
          "INFORMATIONAL": 2,
          "MEDIUM": 2
        }
      },
      "exposure_unknown": {
        "case_count": 10,
        "passed_case_count": 10,
        "exact_match_rate": 1.0,
        "under_triage_count": 0,
        "under_triage_rate": 0.0,
        "mean_deadline_hours": 192.0,
        "action_distribution": {
          "ATTEND": 4,
          "HOLD": 4,
          "TRACK": 2
        },
        "priority_distribution": {
          "HIGH": 6,
          "INFORMATIONAL": 2,
          "MEDIUM": 2
        }
      },
      "high_criticality": {
        "case_count": 10,
        "passed_case_count": 10,
        "exact_match_rate": 1.0,
        "under_triage_count": 0,
        "under_triage_rate": 0.0,
        "mean_deadline_hours": 192.0,
        "action_distribution": {
          "ATTEND": 4,
          "HOLD": 4,
          "TRACK": 2
        },
        "priority_distribution": {
          "HIGH": 6,
          "INFORMATIONAL": 2,
          "MEDIUM": 2
        }
      },
      "internet_exposed": {
        "case_count": 10,
        "passed_case_count": 10,
        "exact_match_rate": 1.0,
        "under_triage_count": 0,
        "under_triage_rate": 0.0,
        "mean_deadline_hours": 172.8,
        "action_distribution": {
          "ACT": 4,
          "HOLD": 4,
          "TRACK": 2
        },
        "priority_distribution": {
          "CRITICAL": 4,
          "HIGH": 2,
          "INFORMATIONAL": 2,
          "MEDIUM": 2
        }
      },
      "kev_listed": {
        "case_count": 10,
        "passed_case_count": 10,
        "exact_match_rate": 1.0,
        "under_triage_count": 0,
        "under_triage_rate": 0.0,
        "mean_deadline_hours": 163.2,
        "action_distribution": {
          "ACT": 4,
          "HOLD": 4,
          "TRACK": 2
        },
        "priority_distribution": {
          "CRITICAL": 8,
          "INFORMATIONAL": 2
        }
      },
      "mission_essential": {
        "case_count": 10,
        "passed_case_count": 10,
        "exact_match_rate": 1.0,
        "under_triage_count": 0,
        "under_triage_rate": 0.0,
        "mean_deadline_hours": 192.0,
        "action_distribution": {
          "ATTEND": 4,
          "HOLD": 4,
          "TRACK": 2
        },
        "priority_distribution": {
          "HIGH": 6,
          "INFORMATIONAL": 2,
          "MEDIUM": 2
        }
      },
      "no_fix_available": {
        "case_count": 10,
        "passed_case_count": 10,